{
  "schema_version": "coach_knowledge_registry.v2",
  "registry_version": "2026-07-22.v2",
  "signal_aliases": {
    "acceleration mismatch high": "accel mismatch high",
    "decel jitter": "sparc low",
    "reverse high": "reverse_ratio high",
    "throughput low": "throughput below reference",
    "two_stage": "submovement two-stage"
  },
  "sources": [
    {"source_ref":"product.complete-coach-spec","source_level":"product_contract","title":"Complete Coach analysis context design","author_or_org":"Aiming Cookie","published_at":"2026-07-20","retrieved_at":"2026-07-22","locator":"complete-coach-spec sections 8-9","applicability":["all_families"],"supports_sections":["definition","scope","expected_direction","mechanisms","limitations","stop_adjust_rule"]},
    {"source_ref":"research.moving-target-control","source_level":"academic_peer_reviewed","title":"Control strategies in directing the hand to moving targets","author_or_org":"Goodbody and Wolpert","published_at":"1992-01-01","retrieved_at":"2026-07-22","locator":"PubMed 1301368; task10-assessment section 6.3","applicability":["dynamic_clicking"],"supports_sections":["mechanisms","limitations"]},
    {"source_ref":"research.visual-motion-extrapolation","source_level":"academic_peer_reviewed","title":"Extrapolation of visual motion for manual interception","author_or_org":"Soechting and Flanders","published_at":"2008-06-01","retrieved_at":"2026-07-22","locator":"J Neurophysiol 10.1152/jn.90308.2008; task10-assessment section 6.3","applicability":["dynamic_clicking"],"supports_sections":["mechanisms","limitations"]},
    {"source_ref":"research.accelerating-object-prediction","source_level":"academic_peer_reviewed","title":"Humans Can Track But Fail to Predict Accelerating Objects","author_or_org":"Kreyenmeier et al.","published_at":"2022-09-09","retrieved_at":"2026-07-22","locator":"PMC9469915; task10-assessment section 6.3","applicability":["dynamic_clicking"],"supports_sections":["mechanisms","limitations"]},
    {"source_ref":"research.manual-intermittent-control","source_level":"academic_peer_reviewed","title":"Intermittency in human manual tracking tasks","author_or_org":"Miall et al.","published_at":"1993-03-01","retrieved_at":"2026-07-22","locator":"PubMed 12730041; task10-assessment section 7.4","applicability":["static_clicking","predictable_tracking","reactive_tracking","control_tracking"],"supports_sections":["mechanisms","limitations"]},
    {"source_ref":"research.sparc-smoothness","source_level":"academic_peer_reviewed","title":"On the analysis of movement smoothness","author_or_org":"Balasubramanian et al.","published_at":"2015-12-09","retrieved_at":"2026-07-22","locator":"PMC4674971; task10-assessment section 7.4","applicability":["static_clicking","control_tracking"],"supports_sections":["mechanisms","limitations"]},
    {"source_ref":"research.sensorimotor-decision","source_level":"academic_peer_reviewed","title":"Decision-making in sensorimotor control","author_or_org":"Gallivan, Chapman, Wolpert, and Flanagan","published_at":"2018-09-01","retrieved_at":"2026-07-22","locator":"PMID 30089888; task10-assessment section 8","applicability":["target_switching"],"supports_sections":["mechanisms","limitations"]},
    {"source_ref":"research.redirected-options","source_level":"academic_peer_reviewed","title":"Reaching movements are automatically redirected to nearby options during target split","author_or_org":"Kurtzer, Muraoka, Singh, Prasad, Chauhan, and Adhami","published_at":"2020-10-01","retrieved_at":"2026-07-22","locator":"PMID 32783570; task10-assessment section 8","applicability":["target_switching"],"supports_sections":["mechanisms","limitations"]},
    {"source_ref":"research.challenge-point","source_level":"academic_peer_reviewed","title":"Challenge point: a framework for conceptualizing the effects of various practice conditions in motor learning","author_or_org":"Guadagnoli and Lee","published_at":"2004-06-01","retrieved_at":"2026-07-22","locator":"PubMed 15130871; task10-assessment section 9.2","applicability":["all_families"],"supports_sections":["dose_guardrail"]},
    {"source_ref":"research.retention-transfer","source_level":"academic_peer_reviewed","title":"The effect of contextual interference on transfer in motor learning: a systematic review and meta-analysis","author_or_org":"Czyz, Wojcik, and Solarska","published_at":"2024-08-14","retrieved_at":"2026-07-22","locator":"PMID 39205981; task10-assessment section 9.3","applicability":["all_families"],"supports_sections":["matched_retest","near_transfer_retest","stop_adjust_rule"]},
    {"source_ref":"research.mouse-fatigue","source_level":"academic_peer_reviewed","title":"Impact of repetitive mouse aiming on muscle fatigue and fine motor performance of the distal upper limb","author_or_org":"Forman, Nikitin, Lang, Gabriel, Sonne, Kociolek, and Holmes","published_at":"2025-03-13","retrieved_at":"2026-07-22","locator":"PMID 40117860; task10-assessment section 9.2","applicability":["all_families"],"supports_sections":["mechanisms","dose_guardrail","stop_adjust_rule"]},
    {"source_ref":"research.precision-mouse-force","source_level":"academic_peer_reviewed","title":"Effects of precision demands and mental pressure on muscle activation and hand forces in computer mouse tasks","author_or_org":"Visser et al.","published_at":"2004-02-05","retrieved_at":"2026-07-22","locator":"10.1080/00140130310001617967; task10-assessment section 9.2","applicability":["all_families"],"supports_sections":["scope","expected_direction","mechanisms","limitations"]},
    {"source_ref":"community.rawinput-dynamic","source_level":"coach_first_party","title":"Dynamic clicking teaching vocabulary","author_or_org":"Raw Input","published_at":null,"retrieved_at":"2026-07-22","locator":"task10-assessment sections 5-6","applicability":["dynamic_clicking"],"supports_sections":["definition","cue","dose_guardrail"]},
    {"source_ref":"community.rawinput-tracking","source_level":"coach_first_party","title":"Tracking teaching vocabulary","author_or_org":"Raw Input","published_at":null,"retrieved_at":"2026-07-22","locator":"task10-assessment sections 5 and 7","applicability":["predictable_tracking","reactive_tracking","control_tracking"],"supports_sections":["definition","cue","dose_guardrail"]},
    {"source_ref":"community.rawinput-tension","source_level":"coach_first_party","title":"Tension management teaching vocabulary","author_or_org":"Raw Input","published_at":null,"retrieved_at":"2026-07-22","locator":"task10-assessment sections 5 and 9","applicability":["all_families"],"supports_sections":["definition","cue","dose_guardrail"]},
    {"source_ref":"community.voltaic-coaching","source_level":"community_organization","title":"Coaching and benchmark taxonomy","author_or_org":"Voltaic","published_at":null,"retrieved_at":"2026-07-22","locator":"task10-assessment sections 4-5","applicability":["all_families"],"supports_sections":["definition","cue"]}
  ],
  "entries": [
    {
      "entry_id":"static.flicking-terminal-control","entry_version":1,"status":"active","category":"observation_definition","topics":["static_clicking","terminal_control"],"signals":["reverse_ratio high","submovement two-stage","sparc low"],"metric_refs":["metric:settle_time_ms","metric:corrective_count","metric:reverse_ratio","metric:sparc"],"family_scope":["static_clicking"],"observation_refs":["event.flick","metric.terminal_control"],"quality_prerequisites":["input_kinematics_available","same_metric_version","matched_static_condition"],
      "definition":{"section_ref":"static.flicking-terminal-control.definition","claim_level":"deterministic_rule","source_refs":["product.complete-coach-spec"],"text":"Input-derived terminal control describes settling and corrections after a static flick; it is not target-relative error without a reliable target track."},
      "scope":{"section_ref":"static.flicking-terminal-control.scope","claim_level":"deterministic_rule","source_refs":["product.complete-coach-spec"],"text":"Compare only the same metric version and matched static conditions, using the player's own distribution when no calibration exists."},
      "expected_direction":{"section_ref":"static.flicking-terminal-control.direction","claim_level":"deterministic_rule","source_refs":["product.complete-coach-spec"],"text":"comparison_only"},
      "mechanisms":[{"section_ref":"static.flicking-terminal-control.mechanism","claim_level":"research_supported","source_refs":["research.manual-intermittent-control","research.sparc-smoothness"],"text":"Terminal adjustments can reflect task precision demands and movement control, but this observation does not identify a single cause."}],
      "alternative_explanations":["target size or distance changed","event segmentation changed","deliberate pacing changed"],"forbidden_inferences":["Do not label input-only corrections as visual overshoot.","Do not infer grip, muscle tension, or pain."],"limitations":["No absolute healthy threshold is available."],"counterevidence":["A matched run with equal outcome and lower correction burden weakens this candidate."],
      "cue":{"section_ref":"static.flicking-terminal-control.cue","claim_level":"community_practice","source_refs":["community.voltaic-coaching"],"text":"Use one task-effect cue: arrive under control, then let the click follow the settled aim point."},
      "dose_guardrail":[{"section_ref":"static.flicking-terminal-control.dose","claim_level":"research_supported","source_refs":["research.challenge-point","research.mouse-fatigue"],"text":"Use a readable variant and change only one task variable; stop or reduce difficulty when discomfort or cue-unrelated quality collapse appears."}],
      "matched_retest":{"section_ref":"static.flicking-terminal-control.matched-retest","claim_level":"research_supported","source_refs":["research.retention-transfer"],"text":"Retest later with the same static scenario, settings, metric version, and target condition."},